{
  "schema_version": "artel.family_geometry.v1",
  "archetype": "rect_cabinet",
  "bindings": {
    "width": "Длина",
    "depth": "Глубина",
    "height": "Высота"
  },
  "features": [
    {
      "kind": "door"
    }
  ],
  "source": {
    "kind": "datasheet",
    "ref": "KORF MPU 16.10.2024",
    "confidence": 0.95
  },
  "notes": "Корпус вентустановки + 4 круглых присоединения (приток/вытяжка, вход/выход), флексятся по Присоединение_D. Прямоугольные присоединения 2200-3800 (500x250..600x300) — переключение формы по типоразмеру = следующий шаг.",
  "connectors": [
    {
      "id": "supply_in",
      "domain": "hvac",
      "shape": "round",
      "diameter": "Присоединение_D",
      "host_face": "left",
      "system": "SupplyAir",
      "flow": "in"
    },
    {
      "id": "supply_out",
      "domain": "hvac",
      "shape": "round",
      "diameter": "Присоединение_D",
      "host_face": "top",
      "system": "SupplyAir",
      "flow": "out"
    },
    {
      "id": "exhaust_in",
      "domain": "hvac",
      "shape": "round",
      "diameter": "Присоединение_D",
      "host_face": "right",
      "system": "ExhaustAir",
      "flow": "in"
    },
    {
      "id": "exhaust_out",
      "domain": "hvac",
      "shape": "round",
      "diameter": "Присоединение_D",
      "host_face": "back",
      "system": "ExhaustAir",
      "flow": "out"
    }
  ]
}